[
  {
    "id": "CASE-001",
    "name": "Share Kanazawa",
    "name_ja": "Share Kanazawa",
    "name_en": "Share Kanazawa",
    "location": "Kanazawa Japan",
    "location_ja": "金沢 日本",
    "location_en": "Kanazawa Japan",
    "image_url": "/images/graduation/case-placeholder.svg",
    "image_note": "Image review 2026-07-04: Commons and Openverse found Kanazawa city images only; no exact Share Kanazawa reusable image confirmed.",
    "plan_url": "",
    "section_url": "",
    "concept": "以福利、居住和社区活动混合，弱化机构感并鼓励日常交流。",
    "concept_ja": "「Share Kanazawa」は、福祉・共生・コミュニティ・ケアの関係を読み取る参考事例。用途の複合、運営、居場所のつくり方を卒業設計に転用して考えられる。",
    "concept_en": "Share Kanazawa is a reference case for reading Design topic: 福利, inclusive living, community, care. It can inform thesis thinking about mixed programs, operation, and place-making.",
    "keywords": [
      "福利",
      "共生",
      "社区",
      "照护",
      "共食",
      "生活支持",
      "高龄"
    ],
    "keywords_ja": [
      "福祉",
      "共生",
      "コミュニティ",
      "ケア",
      "共食",
      "生活支援",
      "高齢"
    ],
    "keywords_en": [
      "Design topic: 福利",
      "inclusive living",
      "community",
      "care",
      "shared meals",
      "Design topic: 生活支持",
      "aging"
    ],
    "source_url": "https://www.goi.co.jp/building/share_kanazawa/",
    "year": 2014,
    "architect": "GOI Architecture & Associates",
    "status": "draft"
  },
  {
    "id": "CASE-002",
    "name": "Kamikatsu Zero Waste Center",
    "name_ja": "Kamikatsu Zero Waste Center",
    "name_en": "Kamikatsu Zero Waste Center",
    "location": "Kamikatsu Japan",
    "location_ja": "Kamikatsu 日本",
    "location_en": "Kamikatsu Japan",
    "image_url": "/images/graduation/cases/case-002-kamikatsu-zero-waste-center.jpeg",
    "image_source_url": "https://commons.wikimedia.org/wiki/File:Kamikatsucho-zero-waste-center.jpeg",
    "image_license": "CC0",
    "image_credit": "Wikimedia Commons",
    "plan_url": "",
    "section_url": "",
    "concept": "把垃圾分类、教育、住宿和社区交流组织成可被公众理解的循环设施。",
    "concept_ja": "ごみ分別、環境教育、滞在、地域食を一つの場所で見せる施設。循環の仕組みを隠さず、地域活動として体験できる点が参考になる。",
    "concept_en": "Kamikatsu Zero Waste Center is a reference case for reading Design topic: 环境, community, reuse, local food. It can inform thesis thinking about mixed programs, operation, and place-making.",
    "keywords": [
      "环境",
      "社区",
      "再利用",
      "地域食",
      "食育"
    ],
    "keywords_ja": [
      "環境",
      "コミュニティ",
      "再利用",
      "地域食",
      "食育"
    ],
    "keywords_en": [
      "Design topic: 环境",
      "community",
      "reuse",
      "local food",
      "food education"
    ],
    "source_url": "https://www.nakam.info/en/works/kamikatsu0/",
    "year": 2020,
    "architect": "Hiroshi Nakamura & NAP",
    "status": "published"
  },
  {
    "id": "CASE-003",
    "name": "ROKI Global Innovation Center  ROOG",
    "name_ja": "ROKI Global Innovation Center ROOG",
    "name_en": "ROKI Global Innovation Center  ROOG",
    "location": "Hamamatsu Japan",
    "location_ja": "Hamamatsu 日本",
    "location_en": "Hamamatsu Japan",
    "image_url": "/images/graduation/case-placeholder.svg",
    "image_note": "Image review 2026-07-04: official and JIAC media found but no reusable license confirmed; Commons and Openverse found no exact image.",
    "plan_url": "",
    "section_url": "",
    "concept": "以连续屋顶和开放工作环境塑造交流、研究和休息混合的工作场。",
    "concept_ja": "連続する大屋根の下に研究、休憩、交流を置くワークプレイス。働く場所を閉じたオフィスではなく、偶然の出会いを生む環境として読める。",
    "concept_en": "ROKI Global Innovation Center  ROOG is a reference case for reading Design topic: 工作, exchange, roof. It can inform thesis thinking about mixed programs, operation, and place-making.",
    "keywords": [
      "工作",
      "交流",
      "屋顶"
    ],
    "keywords_ja": [
      "研究開発",
      "交流",
      "大屋根",
      "ワークプレイス",
      "共創"
    ],
    "keywords_en": [
      "Design topic: 工作",
      "exchange",
      "roof"
    ],
    "source_url": "https://tk-a.jp/en/projects/roki",
    "year": 2013,
    "architect": "Tetsuo Kobori Architects",
    "status": "draft"
  },
  {
    "id": "CASE-004",
    "name": "Naoshima Honmura Lounge and Archive",
    "name_ja": "Naoshima Honmura Lounge and Archive",
    "name_en": "Naoshima Honmura Lounge and Archive",
    "location": "Naoshima Japan",
    "location_ja": "Naoshima 日本",
    "location_en": "Naoshima Japan",
    "image_url": "/images/graduation/case-placeholder.svg",
    "image_note": "Image review 2026-07-04: Openverse found exact Honmura Lounge photos but only NC or NC-ND licenses; placeholder retained.",
    "plan_url": "",
    "section_url": "",
    "concept": "以小尺度公共客厅和档案功能支撑艺术岛居民与访客的交汇。",
    "concept_ja": "「Naoshima Honmura Lounge and Archive」は、アーカイブ・地域・交流・観光の関係を読み取る参考事例。用途の複合、運営、居場所のつくり方を卒業設計に転用して考えられる。",
    "concept_en": "Naoshima Honmura Lounge and Archive is a reference case for reading Design topic: 档案, local, exchange, tourism. It can inform thesis thinking about mixed programs, operation, and place-making.",
    "keywords": [
      "档案",
      "地方",
      "交流",
      "观光",
      "居民生活"
    ],
    "keywords_ja": [
      "アーカイブ",
      "地域",
      "交流",
      "観光",
      "住民生活"
    ],
    "keywords_en": [
      "Design topic: 档案",
      "local",
      "exchange",
      "tourism",
      "Design topic: resident生活"
    ],
    "source_url": "https://benesse-artsite.jp/en/art/arthouse.html",
    "year": null,
    "architect": "Ryue Nishizawa",
    "status": "draft"
  },
  {
    "id": "CASE-005",
    "name": "3331 Arts Chiyoda",
    "name_ja": "3331 Arts Chiyoda",
    "name_en": "3331 Arts Chiyoda",
    "location": "Tokyo Japan",
    "location_ja": "東京 日本",
    "location_en": "Tokyo Japan",
    "image_url": "/images/graduation/cases/case-005-3331-arts-chiyoda.jpg",
    "image_source_url": "https://commons.wikimedia.org/wiki/File:3331_Arts_Chiyoda.JPG",
    "image_license": "CC0",
    "image_credit": "Ootahara / Wikimedia Commons",
    "plan_url": "",
    "section_url": "",
    "concept": "由旧学校改造为艺术、展览和社区活动复合空间，保留教育建筑记忆。",
    "concept_ja": "旧学校の教室や廊下を、展示、制作、市民活動の小さな単位へ転用した事例。既存建物の記憶を残しながら地域へ開く方法を読める。",
    "concept_en": "3331 Arts Chiyoda is a reference case for reading Design topic: 废校, art, community, reuse. It can inform thesis thinking about mixed programs, operation, and place-making.",
    "keywords": [
      "废校",
      "艺术",
      "社区",
      "再利用",
      "创作"
    ],
    "keywords_ja": [
      "廃校",
      "アート",
      "コミュニティ",
      "再利用",
      "創作"
    ],
    "keywords_en": [
      "Design topic: 废校",
      "art",
      "community",
      "reuse",
      "creative production"
    ],
    "source_url": "https://www.3331.jp/en/",
    "year": 2010,
    "architect": "",
    "status": "published"
  },
  {
    "id": "CASE-006",
    "name": "Fuji Kindergarten",
    "name_ja": "Fuji Kindergarten",
    "name_en": "Fuji Kindergarten",
    "location": "Tokyo Japan",
    "location_ja": "東京 日本",
    "location_en": "Tokyo Japan",
    "image_url": "/images/graduation/case-placeholder.svg",
    "image_note": "Image review 2026-07-04: Openverse found exact Fuji Kindergarten photos but only NC-ND licenses; official media has no reusable license confirmed.",
    "plan_url": "",
    "section_url": "",
    "concept": "环形屋顶把奔跑、观察和学习变成日常空间体验。",
    "concept_ja": "「Fuji Kindergarten」は、子ども・教育・屋根・学習の関係を読み取る参考事例。用途の複合、運営、居場所のつくり方を卒業設計に転用して考えられる。",
    "concept_en": "Fuji Kindergarten is a reference case for reading children, education, roof, learning. It can inform thesis thinking about mixed programs, operation, and place-making.",
    "keywords": [
      "儿童",
      "教育",
      "屋顶",
      "学习",
      "生活支持"
    ],
    "keywords_ja": [
      "子ども",
      "教育",
      "屋根",
      "学習",
      "生活支援"
    ],
    "keywords_en": [
      "children",
      "education",
      "roof",
      "learning",
      "Design topic: 生活支持"
    ],
    "source_url": "https://www.tezuka-arch.com/english/works/education/fujiyochien/",
    "year": 2007,
    "architect": "Tezuka Architects",
    "status": "draft"
  },
  {
    "id": "CASE-007",
    "name": "Sendai Mediatheque",
    "name_ja": "Sendai Mediatheque",
    "name_en": "Sendai Mediatheque",
    "location": "Sendai Japan",
    "location_ja": "Sendai 日本",
    "location_en": "Sendai Japan",
    "image_url": "/images/graduation/cases/case-007-sendai-mediatheque.jpg",
    "image_source_url": "https://commons.wikimedia.org/wiki/File:SendaiMediatheque.jpg",
    "image_license": "CC BY-SA 3.0",
    "image_credit": "Atsi Otani / Wikimedia Commons",
    "plan_url": "",
    "section_url": "",
    "concept": "以开放楼板和管状结构承载图书馆、展览与市民活动的多层公共性。",
    "concept_ja": "図書館、ギャラリー、メディア機能を一つの公共建築に重ねた事例。用途を固定せず、市民が多様に使える空間構成を比較できる。",
    "concept_en": "Sendai Mediatheque is a reference case for reading library, Design topic: 媒体, publicness, learning. It can inform thesis thinking about mixed programs, operation, and place-making.",
    "keywords": [
      "图书馆",
      "媒体",
      "公共性",
      "学习",
      "第三空间"
    ],
    "keywords_ja": [
      "図書館",
      "メディア",
      "公共性",
      "学習",
      "第三空間"
    ],
    "keywords_en": [
      "library",
      "Design topic: 媒体",
      "publicness",
      "learning",
      "third place"
    ],
    "source_url": "https://www.smt.jp/",
    "year": 2001,
    "architect": "Toyo Ito",
    "status": "published"
  },
  {
    "id": "CASE-008",
    "name": "Onagawa Station and Yupo'po",
    "name_ja": "Onagawa Station and Yupo'po",
    "name_en": "Onagawa Station and Yupo'po",
    "location": "Onagawa Japan",
    "location_ja": "Onagawa 日本",
    "location_en": "Onagawa Japan",
    "image_url": "/images/graduation/cases/case-008-onagawa-station-yupopo.jpg",
    "image_source_url": "https://commons.wikimedia.org/wiki/File:JR_East_Onagawa_Station_building%2C_Miyagi_Pref_20240420.jpg",
    "image_license": "CC BY-SA 4.0",
    "image_credit": "Photo: Mister0124 / Wikimedia Commons",
    "image_note": "Source-safe image review 2026-07-04: exact exterior image confirmed through Wikimedia Commons metadata.",
    "plan_url": "",